{"$defs":{"atom":{"additionalProperties":false,"properties":{"atom_id":{"pattern":"^A[0-9]{2}$","type":"string"},"required":{"const":true},"source_key":{"pattern":"^[a-z0-9]+(?:-[a-z0-9]+)*$","type":"string"},"variants":{"items":{"minLength":1,"type":"string"},"minItems":1,"type":"array"}},"required":["atom_id","source_key","variants","required"],"type":"object"},"fitness":{"additionalProperties":false,"properties":{"directness":{"maximum":2,"minimum":0,"type":"integer"},"integrity":{"maximum":2,"minimum":0,"type":"integer"},"publisher_authority":{"maximum":2,"minimum":0,"type":"integer"},"rationale":{"minLength":1,"type":"string"},"reuse_basis":{"maximum":2,"minimum":0,"type":"integer"},"source_key":{"pattern":"^[a-z0-9]+(?:-[a-z0-9]+)*$","type":"string"},"temporal_fit":{"maximum":2,"minimum":0,"type":"integer"}},"required":["source_key","publisher_authority","directness","temporal_fit","integrity","reuse_basis","rationale"],"type":"object"},"question":{"additionalProperties":false,"properties":{"acceptable_sources":{"items":{"pattern":"^[a-z0-9]+(?:-[a-z0-9]+)*$","type":"string"},"maxItems":2,"type":"array"},"answerable":{"type":"boolean"},"language":{"enum":["de","en","es"]},"operator_query":{"minLength":1,"type":"string"},"question":{"minLength":1,"type":"string"},"question_id":{"pattern":"^H[0-9]{3}$","type":"string"},"reference_answer":{"minLength":1,"type":"string"},"required_formats":{"const":["md"]},"required_sources":{"items":{"pattern":"^[a-z0-9]+(?:-[a-z0-9]+)*$","type":"string"},"maxItems":2,"type":"array"},"source_fitness":{"items":{"$ref":"#/$defs/fitness"},"maxItems":2,"type":"array"},"stratum":{"enum":["cross_language","direct","multi_source","source_discrimination","unsupported"]},"support_atoms":{"items":{"$ref":"#/$defs/atom"},"maxItems":2,"type":"array"},"temporal_scope":{"const":"historical_document"},"upstream_qa_ids":{"items":{"type":"string"},"maxItems":2,"minItems":1,"type":"array"},"upstream_titles":{"items":{"type":"string"},"maxItems":2,"minItems":1,"type":"array"}},"required":["question_id","language","stratum","question","operator_query","reference_answer","answerable","temporal_scope","required_formats","required_sources","acceptable_sources","support_atoms","source_fitness","upstream_qa_ids","upstream_titles"],"type":"object"}},"$id":"https://openardp.org/schemas/benchmark/retrieval-holdout-questions-0.1.0.json","$schema":"https://json-schema.org/draft/2020-12/schema","additionalProperties":false,"properties":{"benchmark_version":{"const":"0.1.0"},"corpus_id":{"const":"sha256:a5047bbd768cd2927da302da94ded5fa8449a2a3df097ec482f9f6ca708eaca3"},"license":{"const":"CC-BY-SA-4.0"},"question_set_id":{"pattern":"^sha256:[0-9a-f]{64}$","type":"string"},"questions":{"items":{"$ref":"#/$defs/question"},"maxItems":100,"minItems":100,"type":"array"},"schema_version":{"const":"0.1.0"},"upstream_lock_id":{"pattern":"^sha256:[0-9a-f]{64}$","type":"string"}},"required":["schema_version","benchmark_version","corpus_id","license","upstream_lock_id","questions","question_set_id"],"type":"object"}
