{"benchmark_version":"0.1.0","corpus_id":"sha256:a5047bbd768cd2927da302da94ded5fa8449a2a3df097ec482f9f6ca708eaca3","license":"CC-BY-SA-4.0","question_set_id":"sha256:5648e59596d1e6bc95cf786f5bdf8a9da8856d8d1f6ee072621014be1b848c61","questions":[{"acceptable_sources":["xquad-civil-disobedience"],"answerable":true,"language":"en","operator_query":"What type of punishment is sometimes offered to civil disobedients?","question":"What type of punishment is sometimes offered to civil disobedients?","question_id":"H001","reference_answer":"plea bargain","required_formats":["md"],"required_sources":["xquad-civil-disobedience"],"source_fitness":[{"directness":2,"integrity":2,"publisher_authority":1,"rationale":"Pinned XQuAD/SQuAD excerpt directly containing the professionally aligned answer span.","reuse_basis":2,"source_key":"xquad-civil-disobedience","temporal_fit":2}],"stratum":"direct","support_atoms":[{"atom_id":"A01","required":true,"source_key":"xquad-civil-disobedience","variants":["plea bargain"]}],"temporal_scope":"historical_document","upstream_qa_ids":["5728eef92ca10214002daab0"],"upstream_titles":["Civil_disobedience"]},{"acceptable_sources":["xquad-civil-disobedience"],"answerable":true,"language":"de","operator_query":"Der revolutionäre zivile Ungehorsam gegenüber einer Kultur wird am Beispiel von wem hervorgehoben?","question":"Der revolutionäre zivile Ungehorsam gegenüber einer Kultur wird am Beispiel von wem hervorgehoben?","question_id":"H002","reference_answer":"Gandhi's","required_formats":["md"],"required_sources":["xquad-civil-disobedience"],"source_fitness":[{"directness":2,"integrity":2,"publisher_authority":1,"rationale":"Pinned XQuAD/SQuAD excerpt directly containing the professionally aligned answer span.","reuse_basis":2,"source_key":"xquad-civil-disobedience","temporal_fit":2}],"stratum":"cross_language","support_atoms":[{"atom_id":"A01","required":true,"source_key":"xquad-civil-disobedience","variants":["Gandhi's"]}],"temporal_scope":"historical_document","upstream_qa_ids":["5728202c4b864d19001644ef"],"upstream_titles":["Civil_disobedience"]},{"acceptable_sources":["xquad-civil-disobedience"],"answerable":true,"language":"es","operator_query":"¿Cómo se puede protestar contra las grandes empresas de una manera no violenta?","question":"¿Cómo se puede protestar contra las grandes empresas de una manera no violenta?","question_id":"H003","reference_answer":"padlocking the gates","required_formats":["md"],"required_sources":["xquad-civil-disobedience"],"source_fitness":[{"directness":2,"integrity":2,"publisher_authority":1,"rationale":"Pinned XQuAD/SQuAD excerpt directly containing the professionally aligned answer span.","reuse_basis":2,"source_key":"xquad-civil-disobedience","temporal_fit":2}],"stratum":"cross_language","support_atoms":[{"atom_id":"A01","required":true,"source_key":"xquad-civil-disobedience","variants":["padlocking the gates"]}],"temporal_scope":"historical_document","upstream_qa_ids":["5728e715ff5b5019007da918"],"upstream_titles":["Civil_disobedience"]},{"acceptable_sources":["xquad-civil-disobedience"],"answerable":true,"language":"en","operator_query":"The Hungarians performed this civil disobedience under the direction of what person?","question":"The Hungarians performed this civil disobedience under the direction of what person?","question_id":"H004","reference_answer":"Ferenc Deák","required_formats":["md"],"required_sources":["xquad-civil-disobedience"],"source_fitness":[{"directness":2,"integrity":2,"publisher_authority":1,"rationale":"Pinned XQuAD/SQuAD excerpt directly containing the professionally aligned answer span.","reuse_basis":2,"source_key":"xquad-civil-disobedience","temporal_fit":2}],"stratum":"direct","support_atoms":[{"atom_id":"A01","required":true,"source_key":"xquad-civil-disobedience","variants":["Ferenc Deák"]}],"temporal_scope":"historical_document","upstream_qa_ids":["5728202c4b864d19001644ee"],"upstream_titles":["Civil_disobedience"]},{"acceptable_sources":["xquad-doctor-who"],"answerable":true,"language":"en","operator_query":"Who played the companion named Donna Noble?","question":"Who played the companion named Donna Noble?","question_id":"H005","reference_answer":"Catherine Tate","required_formats":["md"],"required_sources":["xquad-doctor-who"],"source_fitness":[{"directness":2,"integrity":2,"publisher_authority":1,"rationale":"Pinned XQuAD/SQuAD excerpt directly containing the professionally aligned answer span.","reuse_basis":2,"source_key":"xquad-doctor-who","temporal_fit":2}],"stratum":"direct","support_atoms":[{"atom_id":"A01","required":true,"source_key":"xquad-doctor-who","variants":["Catherine Tate"]}],"temporal_scope":"historical_document","upstream_qa_ids":["572811434b864d1900164390"],"upstream_titles":["Doctor_Who"]},{"acceptable_sources":["xquad-doctor-who"],"answerable":true,"language":"de","operator_query":"Wie hieß die Folge von Simpsons erster Doctor Who-Partitur?","question":"Wie hieß die Folge von Simpsons erster Doctor Who-Partitur?","question_id":"H006","reference_answer":"Planet of Giants","required_formats":["md"],"required_sources":["xquad-doctor-who"],"source_fitness":[{"directness":2,"integrity":2,"publisher_authority":1,"rationale":"Pinned XQuAD/SQuAD excerpt directly containing the professionally aligned answer span.","reuse_basis":2,"source_key":"xquad-doctor-who","temporal_fit":2}],"stratum":"cross_language","support_atoms":[{"atom_id":"A01","required":true,"source_key":"xquad-doctor-who","variants":["Planet of Giants"]}],"temporal_scope":"historical_document","upstream_qa_ids":["57281a952ca10214002d9deb"],"upstream_titles":["Doctor_Who"]},{"acceptable_sources":["xquad-doctor-who"],"answerable":true,"language":"es","operator_query":"¿Qué Doctor Who fue escrito sin el Doctor Who en él?","question":"¿Qué Doctor Who fue escrito sin el Doctor Who en él?","question_id":"H007","reference_answer":"The Curse of the Daleks","required_formats":["md"],"required_sources":["xquad-doctor-who"],"source_fitness":[{"directness":2,"integrity":2,"publisher_authority":1,"rationale":"Pinned XQuAD/SQuAD excerpt directly containing the professionally aligned answer span.","reuse_basis":2,"source_key":"xquad-doctor-who","temporal_fit":2}],"stratum":"cross_language","support_atoms":[{"atom_id":"A01","required":true,"source_key":"xquad-doctor-who","variants":["The Curse of the Daleks"]}],"temporal_scope":"historical_document","upstream_qa_ids":["572828383acd2414000df5c5"],"upstream_titles":["Doctor_Who"]},{"acceptable_sources":["xquad-doctor-who"],"answerable":true,"language":"en","operator_query":"What was the name of the Doctor Who play from the 1980's?","question":"What was the name of the Doctor Who play from the 1980's?","question_id":"H008","reference_answer":"Doctor Who – The Ultimate Adventure","required_formats":["md"],"required_sources":["xquad-doctor-who"],"source_fitness":[{"directness":2,"integrity":2,"publisher_authority":1,"rationale":"Pinned XQuAD/SQuAD excerpt directly containing the professionally aligned answer span.","reuse_basis":2,"source_key":"xquad-doctor-who","temporal_fit":2}],"stratum":"direct","support_atoms":[{"atom_id":"A01","required":true,"source_key":"xquad-doctor-who","variants":["Doctor Who – The Ultimate Adventure"]}],"temporal_scope":"historical_document","upstream_qa_ids":["572828383acd2414000df5c4"],"upstream_titles":["Doctor_Who"]},{"acceptable_sources":["xquad-french-and-indian-war"],"answerable":true,"language":"en","operator_query":"Upon learning of a French scounting party in the area, what did Washington do?","question":"Upon learning of a French scounting party in the area, what did Washington do?","question_id":"H009","reference_answer":"surprised the Canadians on May 28","required_formats":["md"],"required_sources":["xquad-french-and-indian-war"],"source_fitness":[{"directness":2,"integrity":2,"publisher_authority":1,"rationale":"Pinned XQuAD/SQuAD excerpt directly containing the professionally aligned answer span.","reuse_basis":2,"source_key":"xquad-french-and-indian-war","temporal_fit":2}],"stratum":"direct","support_atoms":[{"atom_id":"A01","required":true,"source_key":"xquad-french-and-indian-war","variants":["surprised the Canadians on May 28"]}],"temporal_scope":"historical_document","upstream_qa_ids":["5733f309d058e614000b6648"],"upstream_titles":["French_and_Indian_War"]},{"acceptable_sources":["xquad-french-and-indian-war"],"answerable":true,"language":"de","operator_query":"Wo lebten die britischen Siedler?","question":"Wo lebten die britischen Siedler?","question_id":"H010","reference_answer":"from Nova Scotia and Newfoundland in the north, to Georgia in the south","required_formats":["md"],"required_sources":["xquad-french-and-indian-war"],"source_fitness":[{"directness":2,"integrity":2,"publisher_authority":1,"rationale":"Pinned XQuAD/SQuAD excerpt directly containing the professionally aligned answer span.","reuse_basis":2,"source_key":"xquad-french-and-indian-war","temporal_fit":2}],"stratum":"cross_language","support_atoms":[{"atom_id":"A01","required":true,"source_key":"xquad-french-and-indian-war","variants":["from Nova Scotia and Newfoundland in the north, to Georgia in the south"]}],"temporal_scope":"historical_document","upstream_qa_ids":["5733d68ed058e614000b6380"],"upstream_titles":["French_and_Indian_War"]},{"acceptable_sources":["xquad-french-and-indian-war"],"answerable":true,"language":"es","operator_query":"¿Qué marco temporal abarca la Guerra de los Siete Años?","question":"¿Qué marco temporal abarca la Guerra de los Siete Años?","question_id":"H011","reference_answer":"1756 to the signing of the peace treaty in 1763","required_formats":["md"],"required_sources":["xquad-french-and-indian-war"],"source_fitness":[{"directness":2,"integrity":2,"publisher_authority":1,"rationale":"Pinned XQuAD/SQuAD excerpt directly containing the professionally aligned answer span.","reuse_basis":2,"source_key":"xquad-french-and-indian-war","temporal_fit":2}],"stratum":"cross_la